{
 "version": "1.0.0",
 "sources": [
  "docs/meta_analisis_ritmo_max4live.md",
  "docs/clasificacion_ritmica_reggae_dub_steppers.md",
  "docs/analisis_corpus_midi.md"
 ],
 "status_legend": {
  "H": "Hecho documentado en la fuente citada",
  "I": "Interpretación analítica compartida en la literatura",
  "Hip": "Hipótesis abierta",
  "V": "Dato por verificar en una transcripción o fuente primaria",
  "C": "Medido en el corpus MIDI de referencia (packs); describe una práctica de programación"
 },
 "axes": [
  {
   "id": "MET",
   "name": "Métrica",
   "question": "¿Cómo se organiza y se divide el tiempo?",
   "color": "#4FC3F7",
   "children": [
    {
     "id": "MET.1",
     "name": "Pulso, tactus y tempo",
     "status": "H",
     "definition": "Serie isócrona que el oyente infiere y a la que sincroniza el cuerpo; el tactus es el nivel más saliente y el tempo su velocidad. Elementos métricos entre ~100 ms y ~2 s.",
     "params": [
      "bpm",
      "tactus_level"
     ]
    },
    {
     "id": "MET.2",
     "name": "Jerarquía métrica",
     "status": "H",
     "definition": "Pulsos periódicos anidados: subdivisión, pulso, compás, hipercompás.",
     "params": [
      "beats_per_bar",
      "beat_division",
      "hyper_len"
     ],
     "children": [
      {
       "id": "MET.2.1",
       "name": "Binaria",
       "status": "H",
       "definition": "Cada nivel se divide en 2 (2/4, 4/4)."
      },
      {
       "id": "MET.2.2",
       "name": "Ternaria",
       "status": "H",
       "definition": "Compás de 3 pulsos (3/4: vals, mazurca, jota, sevillanas)."
      },
      {
       "id": "MET.2.3",
       "name": "Cuaternaria",
       "status": "H",
       "definition": "4 pulsos con jerarquía fuerte, débil, semifuerte, débil."
      },
      {
       "id": "MET.2.4",
       "name": "Compuesta",
       "status": "H",
       "definition": "El pulso se divide en 3 (6/8, 9/8, 12/8)."
      },
      {
       "id": "MET.2.5",
       "name": "Hipermetro",
       "status": "H",
       "definition": "Frases de 2, 4, 8 y 16 compases (Cone, Rothstein); rige la forma de la música electrónica de baile."
      }
     ]
    },
    {
     "id": "MET.3",
     "name": "Compases aditivos y no isócronos",
     "status": "H",
     "definition": "Compases formados por unidades desiguales, típicamente de 2 y 3.",
     "params": [
      "grouping",
      "unit"
     ],
     "children": [
      {
       "id": "MET.3.1",
       "name": "Amalgama",
       "status": "H",
       "definition": "Suma de compases de igual denominador que conservan sus acentos (5/4 = 3/4 + 2/4)."
      },
      {
       "id": "MET.3.2",
       "name": "Compás de tiempos desiguales",
       "status": "H",
       "definition": "Un único compás con pulsos de distinta duración (7/8 = 2+2+3)."
      },
      {
       "id": "MET.3.3",
       "name": "Aksak",
       "status": "H",
       "definition": "Ritmo con dos unidades, breve y larga, en proporción 2:3 (Brăiloiu)."
      },
      {
       "id": "MET.3.4",
       "name": "Métrica no isócrona (NI-meter)",
       "status": "H",
       "definition": "Jerarquía con pulsos de dos o más duraciones, organizada por máxima uniformidad (London)."
      },
      {
       "id": "MET.3.5",
       "name": "Ritmo aditivo / divisivo",
       "status": "H",
       "definition": "El divisivo subdivide una duración; el aditivo suma unidades desiguales (Sachs). Términos usados de forma confusa (London)."
      }
     ]
    },
    {
     "id": "MET.4",
     "name": "Ritmo libre y métricas flexibles",
     "status": "H",
     "definition": "Duraciones sin pulso isócrono o con pulso flexible.",
     "params": [
      "pulse_strength",
      "duration_set"
     ],
     "children": [
      {
       "id": "MET.4.1",
       "name": "Ritmo libre / no medido",
       "status": "H",
       "definition": "Duraciones sin pulso isócrono (canto llano, alap, taqsim, baguala)."
      },
      {
       "id": "MET.4.2",
       "name": "Parlando-rubato y tempo giusto",
       "status": "H",
       "definition": "Canto ligado al habla frente a canto medido y bailable (Bartók)."
      },
      {
       "id": "MET.4.3",
       "name": "Giusto silábico",
       "status": "H",
       "definition": "Cada sílaba toma una de dos duraciones en proporción 1:2 (Brăiloiu)."
      }
     ]
    }
   ]
  },
  {
   "id": "ACE",
   "name": "Acentuación",
   "question": "¿Qué posiciones reciben peso y por qué medio?",
   "color": "#FF8A65",
   "children": [
    {
     "id": "ACE.1",
     "name": "Fuentes del acento",
     "status": "H",
     "definition": "Medios sonoros que dan peso a una posición; Lerdahl y Jackendoff los agrupan en fenoménico, estructural y métrico.",
     "params": [
      "accent_matrix"
     ],
     "children": [
      {
       "id": "ACE.1.1",
       "name": "Métrico",
       "status": "H",
       "definition": "Peso por posición en la jerarquía.",
       "params": [
        "velocity_base"
       ]
      },
      {
       "id": "ACE.1.2",
       "name": "Dinámico",
       "status": "H",
       "definition": "Peso por intensidad.",
       "params": [
        "velocity"
       ]
      },
      {
       "id": "ACE.1.3",
       "name": "Agógico",
       "status": "H",
       "definition": "Peso por duración o leve retraso.",
       "params": [
        "gate",
        "microtiming"
       ]
      },
      {
       "id": "ACE.1.4",
       "name": "Tónico",
       "status": "H",
       "definition": "Peso por altura: picos y saltos de octava.",
       "params": [
        "transpose"
       ]
      },
      {
       "id": "ACE.1.5",
       "name": "Tímbrico",
       "status": "H",
       "definition": "Peso por cambio de color.",
       "params": [
        "cc_filter",
        "timbre"
       ]
      },
      {
       "id": "ACE.1.6",
       "name": "Armónico / textural",
       "status": "H",
       "definition": "Peso por cambio de acorde o de densidad.",
       "params": [
        "chord_change"
       ]
      }
     ]
    },
    {
     "id": "ACE.2",
     "name": "Desplazamiento del acento",
     "status": "H",
     "definition": "Ataques que trasladan el peso a posiciones débiles.",
     "params": [
      "shift_steps",
      "tie",
      "level"
     ],
     "children": [
      {
       "id": "ACE.2.1",
       "name": "Síncopa (hispana)",
       "status": "H",
       "definition": "Ataque en parte débil que se prolonga sobre la parte fuerte siguiente."
      },
      {
       "id": "ACE.2.2",
       "name": "Contratiempo",
       "status": "H",
       "definition": "Ataque en parte débil precedido de silencio en la fuerte; base del skank y del hi-hat abierto del house."
      },
      {
       "id": "ACE.2.3",
       "name": "Anticipación",
       "status": "H",
       "definition": "El ataque llega antes del tiempo fuerte y lo ocupa (tumbao, pushes de acordes)."
      },
      {
       "id": "ACE.2.4",
       "name": "Síncopa amplia (syncopation)",
       "status": "H",
       "definition": "Ataque en posición débil seguido de silencio en posición más fuerte; definición de los estudios de groove."
      }
     ]
    },
    {
     "id": "ACE.3",
     "name": "Inicio y cierre de frase",
     "status": "H",
     "definition": "Relación del comienzo y el final de la frase con el tiempo fuerte.",
     "params": [
      "phrase_offset",
      "downbeat_mute"
     ],
     "children": [
      {
       "id": "ACE.3.1",
       "name": "Tético",
       "status": "H",
       "definition": "La frase empieza en el tiempo fuerte."
      },
      {
       "id": "ACE.3.2",
       "name": "Anacrúsico",
       "status": "H",
       "definition": "Empieza con notas previas al tiempo fuerte."
      },
      {
       "id": "ACE.3.3",
       "name": "Acéfalo",
       "status": "H",
       "definition": "El tiempo fuerte inicial es silencio."
      },
      {
       "id": "ACE.3.4",
       "name": "Final masculino / femenino",
       "status": "H",
       "definition": "La frase termina en tiempo fuerte o débil."
      }
     ]
    }
   ]
  },
  {
   "id": "SUP",
   "name": "Superposición",
   "question": "¿Cómo conviven varias capas?",
   "color": "#BA68C8",
   "children": [
    {
     "id": "SUP.1",
     "name": "Polirritmia",
     "status": "H",
     "definition": "Capas con agrupamientos distintos dentro de un mismo ciclo, que coinciden periódicamente.",
     "params": [
      "ratio_a",
      "ratio_b",
      "cycle_len"
     ],
     "children": [
      {
       "id": "SUP.1.1",
       "name": "3:2",
       "status": "H",
       "definition": "Tres contra dos sobre 6 pulsos."
      },
      {
       "id": "SUP.1.2",
       "name": "4:3",
       "status": "H",
       "definition": "Cuatro contra tres sobre 12 pulsos."
      },
      {
       "id": "SUP.1.3",
       "name": "Contramétrica (Arom)",
       "status": "H",
       "definition": "Figura cíclica que contradice sistemáticamente el pulso de la danza."
      },
      {
       "id": "SUP.1.4",
       "name": "Cross-rhythm (Jones)",
       "status": "H",
       "definition": "Ambas capas tienen estatus de pulso."
      }
     ]
    },
    {
     "id": "SUP.2",
     "name": "Polimetría",
     "status": "H",
     "definition": "Ciclos de distinta longitud superpuestos que se realinean cada mcm de sus longitudes. Agawu discute su aplicación a la música africana.",
     "params": [
      "layer_len"
     ],
     "children": [
      {
       "id": "SUP.2.1",
       "name": "Ciclos de longitud distinta",
       "status": "H",
       "definition": "16 contra 12 se realinean a los 48 pasos; 16 contra 5, a los 80."
      },
      {
       "id": "SUP.2.2",